{
  "schema_version": "devseek.post-r4-local-regression-manifest/v1",
  "integrity": {
    "hash_algorithm": "sha256",
    "canonicalization_version": "devseek-canonical-json/v1"
  },
  "manifest_id": "POST-R4-LOCAL-REGRESSION-MANIFEST/v1",
  "manifest_version": 1,
  "source_status": "generated-source-bound-local-regression-manifest",
  "integrity_scope": "local-post-r4-nonpermission-regression-coverage",
  "qualification_eligible": false,
  "qualification_effect": "NONE",
  "claims_permitted": false,
  "asserts_gate_pass": false,
  "observation_authority": {
    "semantic_authority": "PostR4LocalRegressionManifest",
    "writes_product_state": false,
    "provider_actions": "FORBIDDEN",
    "live_holdout_actions": "FORBIDDEN",
    "runtime_process_observation": "FORBIDDEN",
    "install_or_window_actions": "FORBIDDEN",
    "secret_observation": "FORBIDDEN",
    "qualification_ledger_writes": "FORBIDDEN"
  },
  "source_bindings": {
    "post_r4_nonpermission_plan": {
      "path": "docs/process/devseek-post-r4-nonpermission-iteration-plan.md",
      "source_sha256": "51623b1c2267f8d3f6fcb09b800396e5da12ea083dad5c5ed98f331b8b735555"
    },
    "package_scripts": {
      "path": "package.json",
      "source_sha256": "905afe7a9db3e7f3054609040e5dac1930ca5f786ad53ba822f951ebb702637b",
      "required_script": "verify:post-r4-local-regression-manifest",
      "required_script_present": true
    },
    "phase_gate_source": {
      "path": "scripts/devseek-phase0-12-verify.mjs",
      "source_sha256": "db927db5c6d2bf78ba78e62075bdde17a39c26ccdb41fef9f1847bd496b48702",
      "required_gate": "post-r4-local-regression-manifest",
      "required_gate_present": true
    },
    "checker_source": {
      "path": "scripts/devseek-post-r4-local-regression-manifest-check.mjs",
      "source_sha256": "0a40f519beb07c5034fe4f91b94a8c052939f9d37c061a155a0c177256e567e6"
    },
    "oracle_source": {
      "path": "scripts/test/devseek-post-r4-local-regression-manifest.test.mjs",
      "source_sha256": "d28f218abbc4450944dcf0ef4c2a58730cc2c381f3176f9992db0246dc97405b"
    }
  },
  "regression_scope": {
    "covered_nonpermission_items": [
      "NP-05",
      "NP-06",
      "NP-07"
    ],
    "local_only_product_regression": true,
    "local_process_manifest_only": true,
    "provider_or_window_actions_performed": false,
    "live_rerun_performed": false,
    "qualification_ledger_writes": false,
    "gate0_status": "NOT_PASSED",
    "r1_qualification_status": "NOT_STARTED"
  },
  "regression_tracks": [
    {
      "item_id": "NP-05",
      "title": "Provider protocol replay hardening",
      "source_status": "source-bound-local-regression-track",
      "terminal_state": "COVERED_LOCALLY",
      "plan_heading": "### NP-05 Provider protocol replay hardening",
      "plan_heading_present": true,
      "product_risk": "DeepSeek/Provider corrupted or partial tool output must stay in deterministic replay and never be settled as success.",
      "covered_sources": [
        {
          "path": "packages/vscode-extension/src/agent/fake-tool-parser.ts",
          "role": "provider-tool-text-parser",
          "source_sha256": "82becf1a7744397b12351432bd87b68d4887e16eed0cc016ce8c76ed1215d4d5"
        },
        {
          "path": "packages/vscode-extension/src/agent/provider-output-integrity.ts",
          "role": "provider-integrity-classifier",
          "source_sha256": "15ded0c664875f97fe9664525540bb01efbbaee53e88c5ecb2877faec7333614"
        },
        {
          "path": "packages/vscode-extension/src/diagnostics/run-log-replay.ts",
          "role": "run-log-failure-oracle",
          "source_sha256": "5194693e8b17a4626f08a083d312e9a14c7f346281f3dc90296a11ba3b8fc534"
        },
        {
          "path": "packages/vscode-extension/test/unit/fake-tool-parser.test.mjs",
          "role": "fake-tool-parser-replay-oracle",
          "source_sha256": "a85b5f29791527848a200fd7cdd955384e20797423c0ee95e2b3e7598d348f8d"
        },
        {
          "path": "packages/vscode-extension/test/unit/provider-output-integrity.test.mjs",
          "role": "provider-integrity-replay-oracle",
          "source_sha256": "c18dcbd5872004f13dcf44822d027a631b69ac8415ce7ced58c41545fba97ce5"
        },
        {
          "path": "packages/vscode-extension/test/unit/run-log-replay.test.mjs",
          "role": "run-log-replay-oracle",
          "source_sha256": "929dcabf13afc594f40edbabe2bdf3a133b50d36a25ee3003abc36de5b8cf65e"
        }
      ],
      "anchor_checks": [
        {
          "path": "packages/vscode-extension/test/unit/fake-tool-parser.test.mjs",
          "anchor": "parses R3 live DeepSeek named-parameter tool_call envelopes",
          "category": "named-tool-call-envelope",
          "present": true
        },
        {
          "path": "packages/vscode-extension/test/unit/provider-output-integrity.test.mjs",
          "anchor": "rejects safety-interstitial interrupted tool blocks as truncated",
          "category": "safety-interstitial-truncation",
          "present": true
        },
        {
          "path": "packages/vscode-extension/test/unit/provider-output-integrity.test.mjs",
          "anchor": "classifies malformed DeepSeek function envelopes as executable tool calls",
          "category": "malformed-json-tool-envelope",
          "present": true
        },
        {
          "path": "packages/vscode-extension/src/agent/provider-output-integrity.ts",
          "anchor": "RESPONSE_CORRUPTED",
          "category": "corrupted-provider-output",
          "present": true
        },
        {
          "path": "packages/vscode-extension/src/diagnostics/run-log-replay.ts",
          "anchor": "failure-status-reported-completed",
          "category": "replay-failure-not-overwritten",
          "present": true
        }
      ],
      "verification_commands": [
        {
          "command": "node packages/vscode-extension/test/unit/fake-tool-parser.test.mjs",
          "execution_scope": "local-node-unit-test",
          "live_provider_actions": "FORBIDDEN",
          "install_or_window_actions": "FORBIDDEN",
          "qualification_effect": "NONE",
          "command_is_local_only": true
        },
        {
          "command": "node packages/vscode-extension/test/unit/provider-output-integrity.test.mjs",
          "execution_scope": "local-node-unit-test",
          "live_provider_actions": "FORBIDDEN",
          "install_or_window_actions": "FORBIDDEN",
          "qualification_effect": "NONE",
          "command_is_local_only": true
        },
        {
          "command": "node packages/vscode-extension/test/unit/run-log-replay.test.mjs",
          "execution_scope": "local-node-unit-test",
          "live_provider_actions": "FORBIDDEN",
          "install_or_window_actions": "FORBIDDEN",
          "qualification_effect": "NONE",
          "command_is_local_only": true
        }
      ],
      "local_only_boundary": {
        "provider_prompt_sent": false,
        "live_provider_run_performed": false,
        "vsix_packaged_or_installed": false,
        "window_or_browser_action_performed": false,
        "qualification_ledger_written": false,
        "gate0_or_r1_status_changed": false
      },
      "counts": {
        "covered_sources": 6,
        "anchor_checks": 5,
        "anchors_present": 5,
        "verification_commands": 3,
        "local_only_commands": 3
      }
    },
    {
      "item_id": "NP-06",
      "title": "Terminal settlement and recovered-write regression pack",
      "source_status": "source-bound-local-regression-track",
      "terminal_state": "COVERED_LOCALLY",
      "plan_heading": "### NP-06 Terminal settlement and recovered-write regression pack",
      "plan_heading_present": true,
      "product_risk": "A verified local write must not be overturned by later provider/fetch failure, duplicate recovery, or post-terminal events.",
      "covered_sources": [
        {
          "path": "packages/vscode-extension/src/app/run-context.ts",
          "role": "durable-run-settlement-owner",
          "source_sha256": "b8fac2aea7b12e0b7d2c0463da095afe96e6ed6b6358a6d1b5b7a25496d1bdcd"
        },
        {
          "path": "packages/vscode-extension/src/app/settlement-state.ts",
          "role": "terminal-state-policy",
          "source_sha256": "d2bce0452613011e88e93fe15bf3c7514fd28fb4e34c8c3528673cb0541f63a0"
        },
        {
          "path": "packages/vscode-extension/src/diagnostics/run-log-replay.ts",
          "role": "settlement-replay-oracle",
          "source_sha256": "5194693e8b17a4626f08a083d312e9a14c7f346281f3dc90296a11ba3b8fc534"
        },
        {
          "path": "packages/vscode-extension/test/unit/run-context.test.mjs",
          "role": "run-context-recovery-oracle",
          "source_sha256": "1ef4a5cb5a44e303e3544c7f3ad12ee37ff95d49138391757cf610371b55e004"
        },
        {
          "path": "packages/vscode-extension/test/unit/run-context-settlement.test.mjs",
          "role": "settlement-contract-oracle",
          "source_sha256": "1c864f6f64812be4cb7241bd2fe323e9d8aa111894597bb81aa4ee75f68969ef"
        },
        {
          "path": "packages/vscode-extension/test/unit/workflow-compliance.test.mjs",
          "role": "workflow-static-contract-oracle",
          "source_sha256": "857f5fac8dcf48676fc5156f4144b5591a75a121ba2d24b389bc63518109770d"
        }
      ],
      "anchor_checks": [
        {
          "path": "packages/vscode-extension/test/unit/run-context.test.mjs",
          "anchor": "post-verification provider failure cannot overturn recovered local write completion",
          "category": "late-provider-failure-after-local-success",
          "present": true
        },
        {
          "path": "packages/vscode-extension/test/unit/run-context.test.mjs",
          "anchor": "provider-failure-superseded-by-verified-local-result",
          "category": "recovered-write-resolution",
          "present": true
        },
        {